{
 "counts": {
  "instruments": 95,
  "wedge": 51,
  "series": 14,
  "scheduled": 90
 },
 "series": [
  {
   "letter": "A",
   "title": "Signal metrology: the grader as a measurement device",
   "instruments": [
    "A1",
    "A2",
    "A3",
    "A4",
    "A5",
    "A6",
    "A7"
   ]
  },
  {
   "letter": "B",
   "title": "Grader structure: is this thing a scalar, and what is it made of?",
   "instruments": [
    "B1",
    "B2",
    "B3",
    "B4",
    "B5",
    "B6"
   ]
  },
  {
   "letter": "C",
   "title": "Grader white-box: the existing battery, re-typed",
   "instruments": [
    "C1",
    "C2",
    "C3",
    "C4",
    "C5",
    "C6",
    "C7",
    "C8",
    "C9"
   ]
  },
  {
   "letter": "D",
   "title": "Verifier and environment science",
   "instruments": [
    "D1",
    "D2",
    "D3",
    "D4",
    "D5",
    "D6",
    "D7",
    "D8",
    "D9",
    "D10"
   ]
  },
  {
   "letter": "E",
   "title": "The estimator: where a good reward becomes a bad gradient",
   "instruments": [
    "E1",
    "E2",
    "E3",
    "E4",
    "E5",
    "E6"
   ]
  },
  {
   "letter": "F",
   "title": "The four books",
   "instruments": [
    "F1",
    "F2",
    "F3",
    "F4",
    "F5",
    "F6"
   ]
  },
  {
   "letter": "G",
   "title": "Credit geometry",
   "instruments": [
    "G1",
    "G2",
    "G3",
    "G4",
    "G5"
   ]
  },
  {
   "letter": "H",
   "title": "Rate and regime",
   "instruments": [
    "H1",
    "H2",
    "H3",
    "H4",
    "H5"
   ]
  },
  {
   "letter": "I",
   "title": "Adversarial pressure, and the monitor as a target",
   "instruments": [
    "I1",
    "I2",
    "I3",
    "I4",
    "I5",
    "I6",
    "I7"
   ]
  },
  {
   "letter": "J",
   "title": "Monitoring",
   "instruments": [
    "J1",
    "J2",
    "J3",
    "J4",
    "J5",
    "J6"
   ]
  },
  {
   "letter": "K",
   "title": "Transfer and survival",
   "instruments": [
    "K1",
    "K2",
    "K3",
    "K4"
   ]
  },
  {
   "letter": "L",
   "title": "Reference materials and label metrology",
   "instruments": [
    "L1",
    "L2",
    "L3",
    "L4",
    "L5"
   ]
  },
  {
   "letter": "M",
   "title": "Meta-instruments: measurements about measurements",
   "instruments": [
    "M1",
    "M2",
    "M3",
    "M4",
    "M5",
    "M6",
    "M7",
    "M8",
    "M9",
    "M10",
    "M11"
   ]
  },
  {
   "letter": "N",
   "title": "The frontier: what would happen if we optimised",
   "instruments": [
    "N1",
    "N2",
    "N3",
    "N4",
    "N5",
    "N6",
    "N7",
    "N8"
   ]
  }
 ],
 "instruments": [
  {
   "id": "A1",
   "series": "A",
   "name": "Effective group size",
   "headline": "How many independent gradient-relevant observations a group of K rollouts actually gives you.",
   "quantities": [
    "grader.effective_group_size",
    "run.group_shape_factor"
   ],
   "headlineQuantity": "grader.effective_group_size",
   "accessMin": "GRADER:RECORD (r0), REPLICATE (r2+)",
   "substrates": [
    "COMPOSITE",
    "HUMAN",
    "NEURAL_GEN",
    "NEURAL_SCALAR",
    "PROCEDURAL",
    "PROGRAM"
   ],
   "phases": [
    "PRE_RUN",
    "POST_RUN"
   ],
   "invarianceGroup": "`reward.affine`, `group.permutation`",
   "wedge": true,
   "status": "built",
   "workPackage": "W3.2",
   "envelope": {
    "requires": [
     "GROUP_NONDEGENERATE"
    ],
    "measuredBy": {},
    "unconditionalJustification": null
   },
   "ladder": [
    {
     "rung": 0,
     "estimator": "Kish ESS on observed score spread",
     "access": "`GRADER: RECORD`",
     "bias": "Upward. Ignores correlated grader error entirely.",
     "cost": "Free"
    },
    {
     "rung": 1,
     "estimator": "Test-retest on repeated calls, same input",
     "access": "`GRADER: REPLICATE`",
     "bias": "Upward. Captures occasion but not rater or rubric.",
     "cost": "R calls per item"
    },
    {
     "rung": 2,
     "estimator": "Crossed G-study, item \u00d7 rater \u00d7 occasion",
     "access": "`GRADER: REPLICATE` with facet control",
     "bias": "Approximately unbiased if the design is fully crossed",
     "cost": "n\u00b7r\u00b7o calls"
    },
    {
     "rung": 3,
     "estimator": "Rung 2 plus the item-by-rater interaction `\u03c3\u00b2(p\u00d7r)`",
     "access": "as rung 2, with \u22652 raters",
     "bias": "Unbiased; this is the term that governs co-directional gradients",
     "cost": "n\u00b7r\u00b7o calls, r \u2265 2"
    }
   ],
   "baselines": [
    "group size K itself",
    "a single-rater design"
   ],
   "killCondition": "if r0 and r3 agree within their intervals on five graders, the ladder is decoration and only r0 ships.",
   "says": "\"Your effective group size is 4.2, not 16. You are paying H100-hours for 12 rollouts of grader noise.\"",
   "priorArt": []
  },
  {
   "id": "A2",
   "series": "A",
   "name": "Variance components and gauge R&R",
   "headline": "Facet decomposition of `Var(r)`.",
   "quantities": [
    "grader.variance_components",
    "grader.grr_percent",
    "grader.ndc",
    "grader.design_balance"
   ],
   "headlineQuantity": "grader.variance_components",
   "accessMin": "GRADER:REPLICATE with facet control",
   "substrates": [
    "COMPOSITE",
    "HUMAN",
    "NEURAL_GEN",
    "NEURAL_SCALAR",
    "PROCEDURAL",
    "PROGRAM"
   ],
   "phases": [
    "PRE_RUN"
   ],
   "invarianceGroup": "`reward.affine` (covariant: components scale with the square of the affine parameter, CALIPER line 1415), `group.permutation`",
   "wedge": true,
   "status": "built",
   "workPackage": "W3.2",
   "envelope": {
    "requires": [
     "DESIGN_CROSSED",
     "MASK_STABLE"
    ],
    "measuredBy": {},
    "unconditionalJustification": null
   },
   "ladder": [
    {
     "rung": 0,
     "estimator": "two-facet nested",
     "access": null,
     "bias": null,
     "cost": null
    },
    {
     "rung": 1,
     "estimator": "fully crossed item \u00d7 rater \u00d7 occasion",
     "access": null,
     "bias": null,
     "cost": null
    },
    {
     "rung": 2,
     "estimator": "plus rubric facet",
     "access": null,
     "bias": null,
     "cost": null
    },
    {
     "rung": 3,
     "estimator": "plus finite-universe correction `(1 \u2212 n_i/N_i)` for fixed facets",
     "access": null,
     "bias": null,
     "cost": null
    }
   ],
   "baselines": [
    "a single-draw point estimate, to show what it hides"
   ],
   "killCondition": "if `ndc \u2265 5` on every grader tested, the gauge is adequate and the instrument is a formality.",
   "says": "\"44% of your score variance is which judge you drew. %GRR = 61%, ndc = 2. This gauge cannot resolve two adjacent models.\"",
   "priorArt": []
  },
  {
   "id": "A3",
   "series": "A",
   "name": "Attenuation factor",
   "headline": "How much grader error shrinks the selection signal.",
   "quantities": [
    "grader.attenuation"
   ],
   "headlineQuantity": "grader.attenuation",
   "accessMin": "GRADER:REPLICATE",
   "substrates": [],
   "phases": [],
   "invarianceGroup": "`reward.affine`, `group.permutation`",
   "wedge": true,
   "status": "built",
   "workPackage": "W3.2",
   "envelope": {
    "requires": [
     "GROUP_NONDEGENERATE"
    ],
    "measuredBy": {},
    "unconditionalJustification": null
   },
   "ladder": [
    {
     "rung": 0,
     "estimator": "`\u221a(\u03c3\u00b2_true/(\u03c3\u00b2_true+\u03c3\u00b2_err))` from A2",
     "access": null,
     "bias": null,
     "cost": null
    },
    {
     "rung": 1,
     "estimator": "the errors-in-variables correction `\u03b2_corr = (C_obs \u2212 C_err)\u207b\u00b9S` with `C_err` from within-prompt rollout variance",
     "access": null,
     "bias": null,
     "cost": null
    }
   ],
   "baselines": [
    "uncorrected `\u03b2`"
   ],
   "killCondition": "if the correction never changes a feature ranking, report it once and stop.",
   "says": "\"Your measured selection gradient is 0.71 of the true one. Correcting for it moves feature 3 from rank 7 to rank 2.\"",
   "priorArt": []
  },
  {
   "id": "A4",
   "series": "A",
   "name": "Blackwell order and deficiency",
   "headline": "Rank graders by informativeness rather than accuracy.",
   "quantities": [
    "grader.blackwell_order"
   ],
   "headlineQuantity": "grader.blackwell_order",
   "accessMin": "GRADER:QUERY on a shared labelled slice",
   "substrates": [],
   "phases": [],
   "invarianceGroup": "`reward.affine` (invariant by construction: the order is over channels rather than scores, CALIPER line 1435), `group.permutation`",
   "wedge": false,
   "status": "built",
   "workPackage": "W3.2",
   "envelope": {
    "requires": [],
    "measuredBy": {},
    "unconditionalJustification": "ASSAY line 1634 prints \"Env `SCALAR_REPRESENTABLE` not required\", a negation the merge read as a requirement. The Blackwell order is over channels rather than scores (CALIPER A4 line 1435), so a grader with curl mass above the bound is still orderable and this instrument is the one that says so."
   },
   "ladder": [
    {
     "rung": 0,
     "estimator": "pairwise accuracy (the wrong thing, shown for contrast)",
     "access": null,
     "bias": null,
     "cost": null
    },
    {
     "rung": 1,
     "estimator": "garbling LP",
     "access": null,
     "bias": null,
     "cost": null
    },
    {
     "rung": 2,
     "estimator": "Le Cam deficiency",
     "access": null,
     "bias": null,
     "cost": null
    },
    {
     "rung": 3,
     "estimator": "group-ranking regret at the real K",
     "access": null,
     "bias": null,
     "cost": null
    }
   ],
   "baselines": [
    "RewardBench-style accuracy"
   ],
   "killCondition": "if the Blackwell order and accuracy rank identically on ten graders.",
   "says": "\"Grader B is a garbling of grader A. B is dominated: no downstream use can prefer it.\"",
   "priorArt": []
  },
  {
   "id": "A5",
   "series": "A",
   "name": "Decision study: optimal allocation",
   "headline": "Where the next dollar goes.",
   "quantities": [
    "grader.allocation"
   ],
   "headlineQuantity": "grader.allocation",
   "accessMin": "A2 output",